{
  "$schema": "https://json-schema.org/draft/2020-12/schema",
  "$id": "https://templates.moukaeritai.work/schemas/composition/composition-lock.schema.json",
  "title": "Resolved composition lock",
  "type": "object",
  "additionalProperties": false,
  "required": [
    "schema_version",
    "source",
    "recipe",
    "configuration_sha256",
    "resolved_components",
    "files"
  ],
  "properties": {
    "schema_version": {
      "const": 1
    },
    "source": {
      "type": "object",
      "additionalProperties": false,
      "required": [
        "repository",
        "revision"
      ],
      "properties": {
        "repository": {
          "const": "TakashiSasaki/templates"
        },
        "revision": {
          "type": "string",
          "pattern": "^[0-9a-f]{40}$"
        }
      }
    },
    "recipe": {
      "type": "string",
      "pattern": "^[a-z][a-z0-9]*(?:-[a-z0-9]+)*$"
    },
    "configuration_sha256": {
      "type": "string",
      "pattern": "^[0-9a-f]{64}$"
    },
    "resolved_components": {
      "type": "array",
      "minItems": 1,
      "items": {
        "type": "object",
        "additionalProperties": false,
        "required": [
          "id",
          "version",
          "descriptor_sha256"
        ],
        "properties": {
          "id": {
            "type": "string",
            "pattern": "^(artifact|capability|lifecycle)\\.[a-z][a-z0-9]*(?:-[a-z0-9]+)*$"
          },
          "version": {
            "type": "integer",
            "minimum": 1
          },
          "descriptor_sha256": {
            "type": "string",
            "pattern": "^[0-9a-f]{64}$"
          }
        }
      }
    },
    "files": {
      "type": "array",
      "items": {
        "type": "object",
        "additionalProperties": false,
        "required": [
          "destination",
          "component",
          "ownership",
          "materialized_sha256"
        ],
        "properties": {
          "destination": {
            "type": "string",
            "pattern": "^(?!/)(?![A-Za-z]:)(?!.*(?:^|/)\\.\\.?(?:/|$))(?!.*(?:^|/)\\.git(?:/|$))(?!.*//)[A-Za-z0-9._/-]+$"
          },
          "component": {
            "type": "string",
            "pattern": "^(artifact|capability|lifecycle)\\.[a-z][a-z0-9]*(?:-[a-z0-9]+)*$"
          },
          "ownership": {
            "enum": [
              "managed",
              "seed",
              "generated"
            ]
          },
          "materialized_sha256": {
            "type": "string",
            "pattern": "^[0-9a-f]{64}$"
          }
        }
      }
    }
  }
}
