{
  "schema_version": 1,
  "source": {
    "repository": "TakashiSasaki/templates",
    "revision": "0123456789abcdef0123456789abcdef01234567"
  },
  "recipe": "webapp",
  "configuration_sha256": "1111111111111111111111111111111111111111111111111111111111111111",
  "resolved_components": [
    {
      "id": "artifact.webapp-core",
      "version": 1,
      "descriptor_sha256": "2222222222222222222222222222222222222222222222222222222222222222"
    },
    {
      "id": "capability.mcp",
      "version": 1,
      "descriptor_sha256": "4444444444444444444444444444444444444444444444444444444444444444"
    },
    {
      "id": "capability.runtime",
      "version": 1,
      "descriptor_sha256": "3333333333333333333333333333333333333333333333333333333333333333"
    },
    {
      "id": "lifecycle.contract-evolution",
      "version": 1,
      "descriptor_sha256": "5555555555555555555555555555555555555555555555555555555555555555"
    },
    {
      "id": "lifecycle.implementation-evidence",
      "version": 1,
      "descriptor_sha256": "6666666666666666666666666666666666666666666666666666666666666666"
    },
    {
      "id": "lifecycle.release-evidence",
      "version": 1,
      "descriptor_sha256": "7777777777777777777777777777777777777777777777777777777777777777"
    }
  ],
  "files": [
    {
      "destination": ".template-composition/registry.json",
      "component": "lifecycle.contract-evolution",
      "ownership": "generated",
      "materialized_sha256": "aaaaaaaaaaaaaaaaaaaaaaaaaaaaaaaaaaaaaaaaaaaaaaaaaaaaaaaaaaaaaaaa"
    },
    {
      "destination": "contracts/interfaces/mcp.md",
      "component": "capability.mcp",
      "ownership": "seed",
      "materialized_sha256": "9999999999999999999999999999999999999999999999999999999999999999"
    },
    {
      "destination": "schemas/mcp.schema.json",
      "component": "capability.mcp",
      "ownership": "managed",
      "materialized_sha256": "8888888888888888888888888888888888888888888888888888888888888888"
    }
  ]
}
